{
  "alternative": "LawOrder_JudgementRitual",
  "category": "LawAndOrder",
  "choice": "first",
  "description": {
    "ar": "يمكنك أداء <color=#FFD201>طقس</color> في مجمعك حيث يتقاتل تابعان حتى الموت - ما لم تأخذك الرحمة بهما.",
    "de": "Führe in deinem Tempel ein <color=#FFD201>Ritual</color> durch, bei dem zwei Anhänger sich bis auf den Tod bekämpfen – es sei denn, du fühlst dich barmherzig ….",
    "en": "Perform a <color=#FFD201>Ritual</color> at your Temple in which two Followers fight to the death - unless you're feeling merciful...",
    "es": "Celebra un <color=#FFD201>ritual</color> en tu templo en el que dos de tus adeptos lucharán a muerte... A no ser que desees mostrar misericordia.",
    "fr": "Débloque le <color=#FFD201>rituel</color> permettant d'ordonner à 2 adeptes de se battre jusqu'à la mort... À moins, bien sûr, que vous ne décidiez de faire preuve de clémence...",
    "fr-CA": "<color=#FFD201>Rituel</color> à effectuer dans le Temple et permettant d'ordonner à 2 adeptes de se battre à mort... À moins, bien sûr, que vous ne décidiez de faire preuve de clémence...",
    "it": "Celebra un <color=#FFD201>rito</color> al Tempio in cui due membri del Culto combattono all'ultimo sangue... salvo che tu non mostri clemenza...",
    "ja": "2人の信者を戦わせる<color=#FFD201>儀式</color>を教会堂で行う。この儀式はどちらかが死ぬまで終わらない――あなたが慈悲深ければ話は別だが…",
    "ko": "사원에서 두 추종자들이 둘 중 하나가 죽을 때까지 싸우는 <color=#FFD201>의식</color>을 거행합니다. 혹은 당신이 자비를 베풀기 전까지...",
    "nl": "Voer een <color=#FFD201>ritueel</color> uit in je tempel waarin twee volgelingen vechten tot de dood, tenzij je je genadig voelt...",
    "pt-BR": "Realiza um <color=#FFD201>Ritual</color> em seu templo em que dois Seguidores lutam até a morte. Ou não, se você estiver se sentindo gentil...",
    "ru": "Вы можете провести в храме <color=#FFD201>ритуал</color>, в котором два последователя будут биться насмерть. При желании поединок можно прервать.",
    "tr": "Tapınak'ta bir <color=#FFD201>Ayin</color> düzenleyerek iki Takipçi'nin ölümüne dövüşmesini sağlarsın. Tabii içinden merhamet göstermek gelmiyorsa...",
    "zh-CN": "在你的<color=#FFD201>圣殿</color>举行仪式，命令两位教徒互斗到死——除非你大发慈悲……",
    "zh-TW": "在你的<color=#FFD201>聖殿</color>舉行儀式，命令兩位教徒互鬥到死——除非你大發慈悲……"
  },
  "descriptionPlain": {
    "ar": "يمكنك أداء طقس في مجمعك حيث يتقاتل تابعان حتى الموت - ما لم تأخذك الرحمة بهما.",
    "de": "Führe in deinem Tempel ein Ritual durch, bei dem zwei Anhänger sich bis auf den Tod bekämpfen – es sei denn, du fühlst dich barmherzig ….",
    "en": "Perform a Ritual at your Temple in which two Followers fight to the death - unless you're feeling merciful...",
    "es": "Celebra un ritual en tu templo en el que dos de tus adeptos lucharán a muerte... A no ser que desees mostrar misericordia.",
    "fr": "Débloque le rituel permettant d'ordonner à 2 adeptes de se battre jusqu'à la mort... À moins, bien sûr, que vous ne décidiez de faire preuve de clémence...",
    "fr-CA": "Rituel à effectuer dans le Temple et permettant d'ordonner à 2 adeptes de se battre à mort... À moins, bien sûr, que vous ne décidiez de faire preuve de clémence...",
    "it": "Celebra un rito al Tempio in cui due membri del Culto combattono all'ultimo sangue... salvo che tu non mostri clemenza...",
    "ja": "2人の信者を戦わせる儀式を教会堂で行う。この儀式はどちらかが死ぬまで終わらない――あなたが慈悲深ければ話は別だが…",
    "ko": "사원에서 두 추종자들이 둘 중 하나가 죽을 때까지 싸우는 의식을 거행합니다. 혹은 당신이 자비를 베풀기 전까지...",
    "nl": "Voer een ritueel uit in je tempel waarin twee volgelingen vechten tot de dood, tenzij je je genadig voelt...",
    "pt-BR": "Realiza um Ritual em seu templo em que dois Seguidores lutam até a morte. Ou não, se você estiver se sentindo gentil...",
    "ru": "Вы можете провести в храме ритуал, в котором два последователя будут биться насмерть. При желании поединок можно прервать.",
    "tr": "Tapınak'ta bir Ayin düzenleyerek iki Takipçi'nin ölümüne dövüşmesini sağlarsın. Tabii içinden merhamet göstermek gelmiyorsa...",
    "zh-CN": "在你的圣殿举行仪式，命令两位教徒互斗到死——除非你大发慈悲……",
    "zh-TW": "在你的聖殿舉行儀式，命令兩位教徒互鬥到死——除非你大發慈悲……"
  },
  "icon": "icons/doctrines/LawOrder_FightPitRitual.png",
  "id": "LawOrder_FightPitRitual",
  "kind": "Ritual",
  "level": 2,
  "name": {
    "ar": "ساحة القتال الطقسية",
    "de": "Rituelle Kampfgrube",
    "en": "Ritualistic Fight Pit",
    "es": "Foso de pelea ritualista",
    "fr": "Rituel de l'arène",
    "fr-CA": "Rituel de l'arène",
    "it": "Rito della Fossa dei duelli",
    "ja": "死闘の儀式",
    "ko": "의례적 투기장",
    "nl": "Ritualistische vechtkuil",
    "pt-BR": "Ritual de Luta",
    "ru": "Ритуальный поединок",
    "tr": "Törensel Dövüş Çukuru",
    "zh-CN": "仪式性决斗场",
    "zh-TW": "儀式性決鬥場"
  },
  "namePlain": {
    "ar": "ساحة القتال الطقسية",
    "de": "Rituelle Kampfgrube",
    "en": "Ritualistic Fight Pit",
    "es": "Foso de pelea ritualista",
    "fr": "Rituel de l'arène",
    "fr-CA": "Rituel de l'arène",
    "it": "Rito della Fossa dei duelli",
    "ja": "死闘の儀式",
    "ko": "의례적 투기장",
    "nl": "Ritualistische vechtkuil",
    "pt-BR": "Ritual de Luta",
    "ru": "Ритуальный поединок",
    "tr": "Törensel Dövüş Çukuru",
    "zh-CN": "仪式性决斗场",
    "zh-TW": "儀式性決鬥場"
  },
  "ritual": "Ritual_Fightpit",
  "thumb": "icons/doctrines/64/LawOrder_FightPitRitual.png"
}
