{
  "alternative": "LawOrder_FightPitRitual",
  "category": "LawAndOrder",
  "choice": "second",
  "description": {
    "ar": "يمكنك أداء <color=#FFD201>طقس</color> في مجمعك حيث يكون بوسعك الزواج بأحد أتباعك. اكتساب 30 من العقيدة.",
    "de": "Führe in deinem Tempel ein <color=#FFD201>Ritual</color> durch, damit du einen deiner Anhänger heiraten kannst. Erhalte 30 Glauben.",
    "en": "Perform a <color=#FFD201>Ritual</color> at your Temple so you can marry one of your Followers. Gain 30 Faith.",
    "es": "Celebra un <color=#FFD201>ritual</color> en tu templo para casarte con uno de tus adeptos. Gana 30 de fe.",
    "fr": "Débloque le <color=#FFD201>rituel</color> permettant d'épouser l'un de vos adeptes et de gagner +30 de foi.",
    "fr-CA": "<color=#FFD201>Rituel</color> à effectuer dans le Temple et permettant d'épouser l'un de vos adeptes et de gagner +30 de foi.",
    "it": "Celebra un <color=#FFD201>rito</color> al Tempio che ti permette di sposare un membro del Culto. +30 Fede.",
    "ja": "信者の1人を選び、結婚する<color=#FFD201>儀式</color>を教会堂で行う。信仰を30得る",
    "ko": "사원에서 추종자 중 하나와 혼인<color=#FFD201>식</color>을 거행합니다. 30 신앙을 획득합니다.",
    "nl": "Voer een <color=#FFD201>ritueel</color> uit in je tempel zodat je kunt trouwen met een van je volgelingen. Krijg +30 geloof.",
    "pt-BR": "Realiza um <color=#FFD201>Ritual</color> em seu templo para se casar com um de seus Seguidores. Ganha 30 de Fé",
    "ru": "Вы можете провести в храме <color=#FFD201>ритуал</color> бракосочетания с кем-либо из последователей. Вера увеличится на 30 ед.",
    "tr": "Tapınak'ta bir <color=#FFD201>Ayin</color> düzenleyerek Takipçilerinden biriyle evlenirsin. İnanç 30 artar.",
    "zh-CN": "在你的圣殿举行<color=#FFD201>仪式</color>，让你和一位教徒结婚。获得 30 点信仰值",
    "zh-TW": "在你的聖殿舉行<color=#FFD201>儀式</color>，讓你和一位教徒結婚。獲得 30 點信仰值"
  },
  "descriptionPlain": {
    "ar": "يمكنك أداء طقس في مجمعك حيث يكون بوسعك الزواج بأحد أتباعك. اكتساب 30 من العقيدة.",
    "de": "Führe in deinem Tempel ein Ritual durch, damit du einen deiner Anhänger heiraten kannst. Erhalte 30 Glauben.",
    "en": "Perform a Ritual at your Temple so you can marry one of your Followers. Gain 30 Faith.",
    "es": "Celebra un ritual en tu templo para casarte con uno de tus adeptos. Gana 30 de fe.",
    "fr": "Débloque le rituel permettant d'épouser l'un de vos adeptes et de gagner +30 de foi.",
    "fr-CA": "Rituel à effectuer dans le Temple et permettant d'épouser l'un de vos adeptes et de gagner +30 de foi.",
    "it": "Celebra un rito al Tempio che ti permette di sposare un membro del Culto. +30 Fede.",
    "ja": "信者の1人を選び、結婚する儀式を教会堂で行う。信仰を30得る",
    "ko": "사원에서 추종자 중 하나와 혼인식을 거행합니다. 30 신앙을 획득합니다.",
    "nl": "Voer een ritueel uit in je tempel zodat je kunt trouwen met een van je volgelingen. Krijg +30 geloof.",
    "pt-BR": "Realiza um Ritual em seu templo para se casar com um de seus Seguidores. Ganha 30 de Fé",
    "ru": "Вы можете провести в храме ритуал бракосочетания с кем-либо из последователей. Вера увеличится на 30 ед.",
    "tr": "Tapınak'ta bir Ayin düzenleyerek Takipçilerinden biriyle evlenirsin. İnanç 30 artar.",
    "zh-CN": "在你的圣殿举行仪式，让你和一位教徒结婚。获得 30 点信仰值",
    "zh-TW": "在你的聖殿舉行儀式，讓你和一位教徒結婚。獲得 30 點信仰值"
  },
  "icon": "icons/doctrines/LawOrder_JudgementRitual.png",
  "id": "LawOrder_JudgementRitual",
  "kind": "Ritual",
  "level": 2,
  "name": {
    "ar": "الزواج",
    "de": "Hochzeit",
    "en": "Wedding",
    "es": "Boda",
    "fr": "Rituel nuptial",
    "fr-CA": "Rituel nuptial",
    "it": "Rito nuziale",
    "ja": "結婚式",
    "ko": "결혼",
    "nl": "Huwelijk",
    "pt-BR": "Casamento",
    "ru": "Бракосочетание",
    "tr": "Düğün",
    "zh-CN": "婚礼",
    "zh-TW": "婚禮"
  },
  "namePlain": {
    "ar": "الزواج",
    "de": "Hochzeit",
    "en": "Wedding",
    "es": "Boda",
    "fr": "Rituel nuptial",
    "fr-CA": "Rituel nuptial",
    "it": "Rito nuziale",
    "ja": "結婚式",
    "ko": "결혼",
    "nl": "Huwelijk",
    "pt-BR": "Casamento",
    "ru": "Бракосочетание",
    "tr": "Düğün",
    "zh-CN": "婚礼",
    "zh-TW": "婚禮"
  },
  "ritual": "Ritual_Wedding",
  "thumb": "icons/doctrines/64/LawOrder_JudgementRitual.png"
}
