{
  "alternative": "Sustenance_TraitCannibal",
  "category": "Food",
  "choice": "second",
  "description": {
    "ar": "سيكتسب جميع أعضاء الطائفة <color=#FFD201>سمة آكل العشب.</color> <br> <sprite name=\"icon_FaithUp\"> لن تتأثر العقيدة بالسلب عندما يتناول أحد الأتباع وجبة مصنوعة من العشب.",
    "de": "Alle Kultmitglieder erhalten die <color=#FFD201>Eigenschaft: Grasfresser</color>. <br> <sprite name=\"icon_FaithUp\"> Du verlierst keinen Glauben mehr, wenn ein Anhänger eine Mahlzeit aus Gras isst.",
    "en": "All Cult members will gain the <color=#FFD201>Grass Eater Trait.</color> <br> <sprite name=\"icon_FaithUp\"> No negative Faith when a Follower eats a meal made from grass.",
    "es": "Todos los miembros de la secta reciben el <color=#FFD201>rasgo Herbívoro</color>. <br> <sprite name=\"icon_FaithUp\"> No pierdes fe cuando un adepto coma un plato hecho de hierba.",
    "fr": "Tous les membres du culte gagnent la croyance : <color=#FFD201>Végétarisme</color>. <br> <sprite name=\"icon_FaithUp\"> Les adeptes ne perdent pas de foi en mangeant des plats à base d'herbes.",
    "fr-CA": "Tous les membres de la secte gagnent la croyance : <color=#FFD201>Herbivorisme</color>. <br> <sprite name=\"icon_FaithUp\"> Les adeptes ne perdent pas de foi en mangeant des plats à base d'herbes.",
    "it": "I membri del Culto ricevono il tratto <color=#FFD201>Mangiaerba</color>.<br><sprite name=\"icon_FaithUp\"> Non perde Fede quando un membro del Culto consuma un pasto a base d'erba.",
    "ja": "すべての信者が<color=#FFD201>特性「草食」</color>を得る。 <br> <sprite name=\"icon_FaithUp\"> 雑草料理を食べた際に信仰が減少しなくなる",
    "ko": "모든 교단원들이 <color=#FFD201>채식 특성</color>을 얻습니다. <br> <sprite name=\"icon_FaithUp\">풀로 된 음식을 먹더라도 추종자들의 신앙이 떨어지지 않습니다.",
    "nl": "Alle volgelingen krijgen de eigenschap <color=#FFD201>Graseter.</color> <br> <sprite name=\"icon_FaithUp\"> Geen verlies van geloof wanneer een volgeling een grasmaaltijd eet.",
    "pt-BR": "Todos os membros do Culto ganharão o <color=#FFD201>Aspecto Pastoreio.</color> <br> <sprite name=\"icon_FaithUp\"> Nenhuma Fé será perdida quando Seguidores comerem uma refeição feita de mato.",
    "ru": "Все последователи получают особенность <color=#FFD201>«Вегетарианство»</color>.<br><sprite name=\"icon_FaithUp\"> Вера не уменьшается при поедании травяных салатов.",
    "tr": "Tüm Tarikat üyeleri <color=#FFD201>Çimsever Özelliği</color> kazanır. <br> <sprite name=\"icon_FaithUp\"> Takipçiler çimden yapılmış bir yemek yediğinde İnanç azalmaz.",
    "zh-CN": "所有教会成员将获得<color=#FFD201>草食者特质。</color> <br> <sprite name=\"icon_FaithUp\"> 教徒食用青草制成的餐点时不会产生负面信仰值。",
    "zh-TW": "所有教會成員將獲得<color=#FFD201>草食者特質。</color> <br> <sprite name=\"icon_FaithUp\"> 教徒食用青草製成的餐點時不會產生負面信仰值。"
  },
  "descriptionPlain": {
    "ar": "سيكتسب جميع أعضاء الطائفة سمة آكل العشب.\nلن تتأثر العقيدة بالسلب عندما يتناول أحد الأتباع وجبة مصنوعة من العشب.",
    "de": "Alle Kultmitglieder erhalten die Eigenschaft: Grasfresser.\nDu verlierst keinen Glauben mehr, wenn ein Anhänger eine Mahlzeit aus Gras isst.",
    "en": "All Cult members will gain the Grass Eater Trait.\nNo negative Faith when a Follower eats a meal made from grass.",
    "es": "Todos los miembros de la secta reciben el rasgo Herbívoro.\nNo pierdes fe cuando un adepto coma un plato hecho de hierba.",
    "fr": "Tous les membres du culte gagnent la croyance: Végétarisme.\nLes adeptes ne perdent pas de foi en mangeant des plats à base d'herbes.",
    "fr-CA": "Tous les membres de la secte gagnent la croyance: Herbivorisme.\nLes adeptes ne perdent pas de foi en mangeant des plats à base d'herbes.",
    "it": "I membri del Culto ricevono il tratto Mangiaerba.\nNon perde Fede quando un membro del Culto consuma un pasto a base d'erba.",
    "ja": "すべての信者が特性「草食」を得る。\n雑草料理を食べた際に信仰が減少しなくなる",
    "ko": "모든 교단원들이 채식 특성을 얻습니다.\n풀로 된 음식을 먹더라도 추종자들의 신앙이 떨어지지 않습니다.",
    "nl": "Alle volgelingen krijgen de eigenschap Graseter.\nGeen verlies van geloof wanneer een volgeling een grasmaaltijd eet.",
    "pt-BR": "Todos os membros do Culto ganharão o Aspecto Pastoreio.\nNenhuma Fé será perdida quando Seguidores comerem uma refeição feita de mato.",
    "ru": "Все последователи получают особенность «Вегетарианство».\nВера не уменьшается при поедании травяных салатов.",
    "tr": "Tüm Tarikat üyeleri Çimsever Özelliği kazanır.\nTakipçiler çimden yapılmış bir yemek yediğinde İnanç azalmaz.",
    "zh-CN": "所有教会成员将获得草食者特质。\n教徒食用青草制成的餐点时不会产生负面信仰值。",
    "zh-TW": "所有教會成員將獲得草食者特質。\n教徒食用青草製成的餐點時不會產生負面信仰值。"
  },
  "icon": "icons/doctrines/Sustenance_TraitGrassEater.png",
  "id": "Sustenance_TraitGrassEater",
  "kind": "Trait",
  "level": 2,
  "name": {
    "ar": "سمة آكل العشب",
    "de": "Eigenschaft: Grasfresser",
    "en": "Grass Eater Trait",
    "es": "Rasgo Herbívoro",
    "fr": "Croyance : Végétarisme",
    "fr-CA": "Croyance : Herbivorisme",
    "it": "Tratto: Mangiaerba",
    "ja": "特性「草食」",
    "ko": "채식 특성",
    "nl": "Graseter-eigenschap",
    "pt-BR": "Aspecto Pastoreio",
    "ru": "Вегетарианство",
    "tr": "Çimsever Özelliği",
    "zh-CN": "草食者特质",
    "zh-TW": "草食者特質"
  },
  "namePlain": {
    "ar": "سمة آكل العشب",
    "de": "Eigenschaft: Grasfresser",
    "en": "Grass Eater Trait",
    "es": "Rasgo Herbívoro",
    "fr": "Croyance: Végétarisme",
    "fr-CA": "Croyance: Herbivorisme",
    "it": "Tratto: Mangiaerba",
    "ja": "特性「草食」",
    "ko": "채식 특성",
    "nl": "Graseter-eigenschap",
    "pt-BR": "Aspecto Pastoreio",
    "ru": "Вегетарианство",
    "tr": "Çimsever Özelliği",
    "zh-CN": "草食者特质",
    "zh-TW": "草食者特質"
  },
  "ritual": null,
  "thumb": "icons/doctrines/64/Sustenance_TraitGrassEater.png"
}
