{
  "alternative": null,
  "category": "Special",
  "choice": null,
  "description": {
    "ar": "يمكنك اكتساب قدر من العقيدة عند قتل <color=#FFD201>تابع متعفن</color>.",
    "de": "Erhalte Glauben, wenn ein <color=#FFD201>fauliger Anhänger</color> geopfert wird.",
    "en": "Gain Faith when a <color=#FFD201>Rotten Follower</color> is killed.",
    "es": "Gana fe cuando se asesina a un <color=#FFD201>adepto putrefacto</color>.",
    "fr": "Gagne de la foi lorsqu'un <color=#FFD201>adepte putréfié</color> est tué.",
    "fr-CA": "Gagne de la foi lorsqu'un <color=#FFD201>adepte putréfié</color> est tué.",
    "it": "Ottieni Fede quando un <color=#FFD201>membro del Culto marcescente</color> viene eliminato.",
    "ja": "<color=#FFD201>腐敗している信者</color>が殺されるたび、信仰を得る",
    "ko": "<color=#FFD201>부패한 추종자</color>가 사망하면 신앙을 얻습니다.",
    "nl": "Krijg geloof wanneer er een <color=#FFD201>verrotte volgeling</color> wordt gedood.",
    "pt-BR": "Ganhe Fé quando um <color=#FFD201>Seguidor Putrefato</color> for morto.",
    "ru": "Вы получаете веру, когда убиваете <color=#FFD201>гниющего последователя</color>.",
    "tr": "Bir <color=#FFD201>Çürük Takipçi</color> öldürüldüğünde İnanç artar.",
    "zh-CN": "<color=#FFD201>腐烂教徒</color>被杀时，获得信仰值。",
    "zh-TW": "<color=#FFD201>腐爛的教徒</color>被殺死時，獲得信仰值。"
  },
  "descriptionPlain": {
    "ar": "يمكنك اكتساب قدر من العقيدة عند قتل تابع متعفن.",
    "de": "Erhalte Glauben, wenn ein fauliger Anhänger geopfert wird.",
    "en": "Gain Faith when a Rotten Follower is killed.",
    "es": "Gana fe cuando se asesina a un adepto putrefacto.",
    "fr": "Gagne de la foi lorsqu'un adepte putréfié est tué.",
    "fr-CA": "Gagne de la foi lorsqu'un adepte putréfié est tué.",
    "it": "Ottieni Fede quando un membro del Culto marcescente viene eliminato.",
    "ja": "腐敗している信者が殺されるたび、信仰を得る",
    "ko": "부패한 추종자가 사망하면 신앙을 얻습니다.",
    "nl": "Krijg geloof wanneer er een verrotte volgeling wordt gedood.",
    "pt-BR": "Ganhe Fé quando um Seguidor Putrefato for morto.",
    "ru": "Вы получаете веру, когда убиваете гниющего последователя.",
    "tr": "Bir Çürük Takipçi öldürüldüğünde İnanç artar.",
    "zh-CN": "腐烂教徒被杀时，获得信仰值。",
    "zh-TW": "腐爛的教徒被殺死時，獲得信仰值。"
  },
  "icon": "icons/doctrines/Special_RejectRot.png",
  "id": "Special_RejectRot",
  "kind": null,
  "level": 8,
  "name": {
    "ar": "التخلص من التعفن",
    "de": "Beseitige die Fäulnis",
    "en": "Purge the Rot",
    "es": "Purga putrefacta",
    "fr": "À bas la putrescence",
    "fr-CA": "À bas la putrescence",
    "it": "Marciume epurato",
    "ja": "腐敗は浄化せよ",
    "ko": "부패 정화",
    "nl": "Zuiver de rotting",
    "pt-BR": "Expurgar Putrefação",
    "ru": "Борьба с гнилью",
    "tr": "Çürümeden Arındır",
    "zh-CN": "清除腐烂",
    "zh-TW": "淨化腐爛"
  },
  "namePlain": {
    "ar": "التخلص من التعفن",
    "de": "Beseitige die Fäulnis",
    "en": "Purge the Rot",
    "es": "Purga putrefacta",
    "fr": "À bas la putrescence",
    "fr-CA": "À bas la putrescence",
    "it": "Marciume epurato",
    "ja": "腐敗は浄化せよ",
    "ko": "부패 정화",
    "nl": "Zuiver de rotting",
    "pt-BR": "Expurgar Putrefação",
    "ru": "Борьба с гнилью",
    "tr": "Çürümeden Arındır",
    "zh-CN": "清除腐烂",
    "zh-TW": "淨化腐爛"
  },
  "ritual": null,
  "thumb": "icons/doctrines/64/Special_RejectRot.png"
}
