{
  "alternative": "Possessions_MoreFaithFromRituals",
  "category": "Possession",
  "choice": "first",
  "description": {
    "ar": "سيكتسب جميع أعضاء الطائفة <color=#FFD201>سمة العمارة المجيدة</color> <br> <sprite name=\"icon_FaithUp\"> اكتساب +5 من العقيدة عند تشييد بناء جديد.",
    "de": "Alle Kultmitglieder erhalten die <color=#FFD201>Eigenschaft: Sakrale Architektur</color>. <br> <sprite name=\"icon_FaithUp\"> Erhalte +5 Glauben, wenn ein neues Gebäude gebaut wird.",
    "en": "All Cult members will gain the <color=#FFD201>Sacral Architecture Trait</color> <br> <sprite name=\"icon_FaithUp\"> When a new building is constructed gain +5 Faith.",
    "es": "Todos los miembros de la secta reciben el <color=#FFD201>rasgo Arquitectura sacra</color>. <br> <sprite name=\"icon_FaithUp\"> Cuando se construye un edificio nuevo ganas +5 de fe.",
    "fr": "Tous les membres du culte gagnent la croyance : <color=#FFD201>Lieux saints</color>. <br> <sprite name=\"icon_FaithUp\"> +5 de foi pour chaque nouvelle construction.",
    "fr-CA": "Tous les membres de la secte gagnent la croyance : <color=#FFD201>Architecture sacrée</color>. <br> <sprite name=\"icon_FaithUp\"> +5 de foi pour chaque nouvelle construction.",
    "it": "I membri del Culto ricevono il tratto <color=#FFD201>Architettura sacra</color>.<br><sprite name=\"icon_FaithUp\"> +5 Fede quando viene costruita una nuova struttura.",
    "ja": "すべての信者が<color=#FFD201>特性「聖式建築」</color>を得る。 <br> <sprite name=\"icon_FaithUp\"> 建築物が作られるたび、信仰を5得る",
    "ko": "모든 교단원들이 <color=#FFD201>성스러운 건축학 특성</color>을 얻습니다. <br> <sprite name=\"icon_FaithUp\"> 새로운 건물이 건설될 때마다 +5 신앙을 얻습니다.",
    "nl": "Alle volgelingen krijgen de eigenschap <color=#FFD201>Sacrale architectuur.</color> <br> <sprite name=\"icon_FaithUp\"> Krijg +5 geloof wanneer een nieuw gebouw wordt voltooid.",
    "pt-BR": "Todos os membros do Culto ganharão o <color=#FFD201>Aspecto Arquitetura Sagrada</color> <br> <sprite name=\"icon_FaithUp\"> +5 de Fé quando uma nova construção é concluída",
    "ru": "Все последователи получают особенность <color=#FFD201>«Восхищение архитектурой»</color>.<br><sprite name=\"icon_FaithUp\"> Вера увеличивается на 5 ед. после возведения каждой постройки.",
    "tr": "Tüm Tarikat üyeleri <color=#FFD201>Kutsal Mimari Özelliği</color> kazanır. <br> <sprite name=\"icon_FaithUp\"> Bir yapı inşa edildiğinde İnanç 5 artar.",
    "zh-CN": "所有教会成员将获得<color=#FFD201>圣礼建筑特质</color> <br> <sprite name=\"icon_FaithUp\">新建筑建造完成时信仰值 +5",
    "zh-TW": "所有教會成員將獲得<color=#FFD201>聖禮建築特質</color> <br> <sprite name=\"icon_FaithUp\"> 新建築建造完成時信仰值 +5"
  },
  "descriptionPlain": {
    "ar": "سيكتسب جميع أعضاء الطائفة سمة العمارة المجيدة\nاكتساب +5 من العقيدة عند تشييد بناء جديد.",
    "de": "Alle Kultmitglieder erhalten die Eigenschaft: Sakrale Architektur.\nErhalte +5 Glauben, wenn ein neues Gebäude gebaut wird.",
    "en": "All Cult members will gain the Sacral Architecture Trait\nWhen a new building is constructed gain +5 Faith.",
    "es": "Todos los miembros de la secta reciben el rasgo Arquitectura sacra.\nCuando se construye un edificio nuevo ganas +5 de fe.",
    "fr": "Tous les membres du culte gagnent la croyance: Lieux saints.\n+5 de foi pour chaque nouvelle construction.",
    "fr-CA": "Tous les membres de la secte gagnent la croyance: Architecture sacrée.\n+5 de foi pour chaque nouvelle construction.",
    "it": "I membri del Culto ricevono il tratto Architettura sacra.\n+5 Fede quando viene costruita una nuova struttura.",
    "ja": "すべての信者が特性「聖式建築」を得る。\n建築物が作られるたび、信仰を5得る",
    "ko": "모든 교단원들이 성스러운 건축학 특성을 얻습니다.\n새로운 건물이 건설될 때마다 +5 신앙을 얻습니다.",
    "nl": "Alle volgelingen krijgen de eigenschap Sacrale architectuur.\nKrijg +5 geloof wanneer een nieuw gebouw wordt voltooid.",
    "pt-BR": "Todos os membros do Culto ganharão o Aspecto Arquitetura Sagrada\n+5 de Fé quando uma nova construção é concluída",
    "ru": "Все последователи получают особенность «Восхищение архитектурой».\nВера увеличивается на 5 ед. после возведения каждой постройки.",
    "tr": "Tüm Tarikat üyeleri Kutsal Mimari Özelliği kazanır.\nBir yapı inşa edildiğinde İnanç 5 artar.",
    "zh-CN": "所有教会成员将获得圣礼建筑特质\n新建筑建造完成时信仰值 +5",
    "zh-TW": "所有教會成員將獲得聖禮建築特質\n新建築建造完成時信仰值 +5"
  },
  "icon": "icons/doctrines/Possessions_MoreFaithFromHomes.png",
  "id": "Possessions_MoreFaithFromHomes",
  "kind": "Trait",
  "level": 4,
  "name": {
    "ar": "سمة العمارة المجيدة",
    "de": "Eigenschaft: Sakrale Architektur",
    "en": "Sacral Architecture Trait",
    "es": "Rasgo Arquitectura sacra",
    "fr": "Croyance : Lieux saints",
    "fr-CA": "Croyance : Architecture sacrée",
    "it": "Tratto: Architettura sacra",
    "ja": "特性「聖式建築」",
    "ko": "성스러운 건축학 특성",
    "nl": "Sacrale architectuur-eigenschap",
    "pt-BR": "Aspecto Arquitetura Sagrada",
    "ru": "Восхищение архитектурой",
    "tr": "Kutsal Mimari Özelliği",
    "zh-CN": "圣礼建筑特质",
    "zh-TW": "聖禮建築特質"
  },
  "namePlain": {
    "ar": "سمة العمارة المجيدة",
    "de": "Eigenschaft: Sakrale Architektur",
    "en": "Sacral Architecture Trait",
    "es": "Rasgo Arquitectura sacra",
    "fr": "Croyance: Lieux saints",
    "fr-CA": "Croyance: Architecture sacrée",
    "it": "Tratto: Architettura sacra",
    "ja": "特性「聖式建築」",
    "ko": "성스러운 건축학 특성",
    "nl": "Sacrale architectuur-eigenschap",
    "pt-BR": "Aspecto Arquitetura Sagrada",
    "ru": "Восхищение архитектурой",
    "tr": "Kutsal Mimari Özelliği",
    "zh-CN": "圣礼建筑特质",
    "zh-TW": "聖禮建築特質"
  },
  "ritual": null,
  "thumb": "icons/doctrines/64/Possessions_MoreFaithFromHomes.png"
}
