{
  "alternative": "DeathSacrifice_RessurectionRitual",
  "category": "Afterlife",
  "choice": "second",
  "description": {
    "ar": "يمكنك أداء <color=#FFD201>طقس</color> في مجمعك لإقامة جنازة لتابع أدركه الموت حديثًا مع اكتساب 20 من العقيدة.",
    "de": "Führe in deinem Tempel ein <color=#FFD201>Ritual</color> durch, um ein Begräbnis für einen deiner kürzlich verstorbenen Anhänger durchzuführen. Erhalte 20 Glauben.",
    "en": "Perform a <color=#FFD201>Ritual</color> at your temple to conduct a funeral for a recently passed Follower. Gain 20 Faith.",
    "es": "Celebra un <color=#FFD201>ritual</color> en tu templo para organizar un funeral para un adepto que haya fallecido recientemente. Gana 20 de fe.",
    "fr": "Débloque le <color=#FFD201>rituel</color> permettant d'organiser les funérailles d'un adepte mort récemment et de gagner +20 de foi.",
    "fr-CA": "<color=#FFD201>Rituel</color> à effectuer dans le Temple et permettant d'organiser les funérailles d'un adepte mort récemment et de gagner +20 de foi.",
    "it": "Celebri un <color=#FFD201>rito</color> al Tempio per officiare un funerale in onore di un membro recentemente scomparso. +20 Fede.",
    "ja": "最近亡くなった信者を弔うための<color=#FFD201>儀式</color>を教会堂で行う。信仰を20得る",
    "ko": "사원에서 <color=#FFD201>의식</color>을 거행해 최근에 죽은 추종자를 위한 장례식을 거행합니다. 20 신앙을 얻습니다.",
    "nl": "Voer een <color=#FFD201>ritueel</color> uit in je tempel om een begrafenis te houden voor een recent overleden volgeling. Krijg +20 geloof.",
    "pt-BR": "Realiza um <color=#FFD201>Ritual</color> em seu templo para elaborar o funeral de um Seguidor recém-falecido. Ganha 20 de fé",
    "ru": "Вы можете провести в храме <color=#FFD201>ритуал</color> в память о недавно умершем последователе. Вера увеличится на 20 ед.",
    "tr": "Tapınak'ta bir <color=#FFD201>Ayin</color> gerçekleştirerek yakın zamanda ölen bir Takipçi için bir cenaze düzenlersin. İnanç 20 artar.",
    "zh-CN": "在你的圣殿举行<color=#FFD201>仪式</color>，为近日过世的一位教徒举行葬礼。获得 20 点信仰值",
    "zh-TW": "在你的聖殿舉行<color=#FFD201>儀式</color>，為近日過世的一位教徒舉行葬禮。獲得 20 點信仰值"
  },
  "descriptionPlain": {
    "ar": "يمكنك أداء طقس في مجمعك لإقامة جنازة لتابع أدركه الموت حديثًا مع اكتساب 20 من العقيدة.",
    "de": "Führe in deinem Tempel ein Ritual durch, um ein Begräbnis für einen deiner kürzlich verstorbenen Anhänger durchzuführen. Erhalte 20 Glauben.",
    "en": "Perform a Ritual at your temple to conduct a funeral for a recently passed Follower. Gain 20 Faith.",
    "es": "Celebra un ritual en tu templo para organizar un funeral para un adepto que haya fallecido recientemente. Gana 20 de fe.",
    "fr": "Débloque le rituel permettant d'organiser les funérailles d'un adepte mort récemment et de gagner +20 de foi.",
    "fr-CA": "Rituel à effectuer dans le Temple et permettant d'organiser les funérailles d'un adepte mort récemment et de gagner +20 de foi.",
    "it": "Celebri un rito al Tempio per officiare un funerale in onore di un membro recentemente scomparso. +20 Fede.",
    "ja": "最近亡くなった信者を弔うための儀式を教会堂で行う。信仰を20得る",
    "ko": "사원에서 의식을 거행해 최근에 죽은 추종자를 위한 장례식을 거행합니다. 20 신앙을 얻습니다.",
    "nl": "Voer een ritueel uit in je tempel om een begrafenis te houden voor een recent overleden volgeling. Krijg +20 geloof.",
    "pt-BR": "Realiza um Ritual em seu templo para elaborar o funeral de um Seguidor recém-falecido. Ganha 20 de fé",
    "ru": "Вы можете провести в храме ритуал в память о недавно умершем последователе. Вера увеличится на 20 ед.",
    "tr": "Tapınak'ta bir Ayin gerçekleştirerek yakın zamanda ölen bir Takipçi için bir cenaze düzenlersin. İnanç 20 artar.",
    "zh-CN": "在你的圣殿举行仪式，为近日过世的一位教徒举行葬礼。获得 20 点信仰值",
    "zh-TW": "在你的聖殿舉行儀式，為近日過世的一位教徒舉行葬禮。獲得 20 點信仰值"
  },
  "icon": "icons/doctrines/DeathSacrifice_Funeral.png",
  "id": "DeathSacrifice_Funeral",
  "kind": "Ritual",
  "level": 2,
  "name": {
    "ar": "الجنازة",
    "de": "Begräbnis",
    "en": "Funeral",
    "es": "Funeral",
    "fr": "Rituel funéraire",
    "fr-CA": "Rituel funéraire",
    "it": "Rito delle esequie",
    "ja": "葬式",
    "ko": "장례식",
    "nl": "Begrafenis",
    "pt-BR": "Funeral",
    "ru": "Панихида",
    "tr": "Cenaze",
    "zh-CN": "葬礼",
    "zh-TW": "葬禮"
  },
  "namePlain": {
    "ar": "الجنازة",
    "de": "Begräbnis",
    "en": "Funeral",
    "es": "Funeral",
    "fr": "Rituel funéraire",
    "fr-CA": "Rituel funéraire",
    "it": "Rito delle esequie",
    "ja": "葬式",
    "ko": "장례식",
    "nl": "Begrafenis",
    "pt-BR": "Funeral",
    "ru": "Панихида",
    "tr": "Cenaze",
    "zh-CN": "葬礼",
    "zh-TW": "葬禮"
  },
  "ritual": "Ritual_Funeral",
  "thumb": "icons/doctrines/64/DeathSacrifice_Funeral.png"
}
