{
  "alternative": "LawOrder_TraitLibertarian",
  "category": "LawAndOrder",
  "choice": "first",
  "description": {
    "ar": "<sprite name=\"icon_FaithUp\"> يُولد الجميع مذنبين. تقل خسارة العقيدة عند سجن فرد تابع لم يعارضك.",
    "de": "<sprite name=\"icon_FaithUp\"> Alle werden schuldig geboren. Du erleidest einen verringerten Glaubensverlust, wenn ein Anhänger eingesperrt wird, der kein Abweichler ist.",
    "en": "<sprite name=\"icon_FaithUp\"> All are born guilty. Reduced Faith loss when putting a Follower in jail who is not dissenting.",
    "es": "<sprite name=\"icon_FaithUp\"> Todos nacemos con algo de culpa. Si encarcelas a un adepto que no se había rebelado, pierdes menos fe.",
    "fr": "<sprite name=\"icon_FaithUp\"> Nul ne naît libre de tout péché. Réduit la perte de foi lorsqu'un adepte innocent est emprisonné.",
    "fr-CA": "<sprite name=\"icon_FaithUp\"> Nul ne naît libre de tout péché. Réduit la perte de foi lorsqu'un adepte innocent est emprisonné.",
    "it": "<sprite name=\"icon_FaithUp\"> Ciascuno nasce macchiato dal peccato. Riduce la perdita di Fede quando un membro del Culto non dissidente finisce alla Gogna.",
    "ja": "<sprite name=\"icon_FaithUp\"> すべての者は生まれながらに罪人である。離反者ではない信者を投獄した際の信仰の減少量が低下する",
    "ko": "<sprite name=\"icon_FaithUp\"> 모든 존재는 원죄를 안고 태어납니다. 대립 중이 아닌 추종자가 감옥에 들어갔을 때 잃는 신앙이 감소합니다.",
    "nl": "<sprite name=\"icon_FaithUp\"> Iedereen wordt zondig geboren. Minder verlies van geloof wanneer een niet-afvallige volgeling in het gevang wordt gestopt.",
    "pt-BR": "<sprite name=\"icon_FaithUp\"> Todos nascem com culpa. Perda de Fé reduzida ao mandar Seguidores que não se rebelaram para a prisão.",
    "ru": "<sprite name=\"icon_FaithUp\"> Вы теряете меньше веры, когда заключаете в тюрьму последователя, не впавшего в инакомыслие.",
    "tr": "<sprite name=\"icon_FaithUp\"> Herkes suçlu doğar. Başkaldırmayan bir Takipçi boyunduruğa hapsedildiğinde İnanç daha az azalır.",
    "zh-CN": "<sprite name=\"icon_FaithUp\">人人生来有罪。囚禁并未反教的教徒时，损失信仰值的幅度降低。",
    "zh-TW": "<sprite name=\"icon_FaithUp\"> 人人生來有罪。囚禁未反教的教徒時，損失信仰值的幅度降低。"
  },
  "descriptionPlain": {
    "ar": "يُولد الجميع مذنبين. تقل خسارة العقيدة عند سجن فرد تابع لم يعارضك.",
    "de": "Alle werden schuldig geboren. Du erleidest einen verringerten Glaubensverlust, wenn ein Anhänger eingesperrt wird, der kein Abweichler ist.",
    "en": "All are born guilty. Reduced Faith loss when putting a Follower in jail who is not dissenting.",
    "es": "Todos nacemos con algo de culpa. Si encarcelas a un adepto que no se había rebelado, pierdes menos fe.",
    "fr": "Nul ne naît libre de tout péché. Réduit la perte de foi lorsqu'un adepte innocent est emprisonné.",
    "fr-CA": "Nul ne naît libre de tout péché. Réduit la perte de foi lorsqu'un adepte innocent est emprisonné.",
    "it": "Ciascuno nasce macchiato dal peccato. Riduce la perdita di Fede quando un membro del Culto non dissidente finisce alla Gogna.",
    "ja": "すべての者は生まれながらに罪人である。離反者ではない信者を投獄した際の信仰の減少量が低下する",
    "ko": "모든 존재는 원죄를 안고 태어납니다. 대립 중이 아닌 추종자가 감옥에 들어갔을 때 잃는 신앙이 감소합니다.",
    "nl": "Iedereen wordt zondig geboren. Minder verlies van geloof wanneer een niet-afvallige volgeling in het gevang wordt gestopt.",
    "pt-BR": "Todos nascem com culpa. Perda de Fé reduzida ao mandar Seguidores que não se rebelaram para a prisão.",
    "ru": "Вы теряете меньше веры, когда заключаете в тюрьму последователя, не впавшего в инакомыслие.",
    "tr": "Herkes suçlu doğar. Başkaldırmayan bir Takipçi boyunduruğa hapsedildiğinde İnanç daha az azalır.",
    "zh-CN": "人人生来有罪。囚禁并未反教的教徒时，损失信仰值的幅度降低。",
    "zh-TW": "人人生來有罪。囚禁未反教的教徒時，損失信仰值的幅度降低。"
  },
  "icon": "icons/doctrines/LawOrder_TraitDisciplinarian.png",
  "id": "LawOrder_TraitDisciplinarian",
  "kind": "Trait",
  "level": 3,
  "name": {
    "ar": "سمة الإيمان بتأصل الشر",
    "de": "Eigenschaft: Glaube an die Ursünde",
    "en": "Belief in Original Sin Trait",
    "es": "Rasgo Fe en pecado original",
    "fr": "Croyance : Péché originel",
    "fr-CA": "Croyance : Péché originel",
    "it": "Tratto: Fede nel peccato originale",
    "ja": "特性「原罪主義者」",
    "ko": "원죄 신앙 특성",
    "nl": "Geloof in erfzonde-eigenschap",
    "pt-BR": "Aspecto Crença no Pecado Original",
    "ru": "Вера в первородный грех",
    "tr": "Asli Günah İnancı Özelliği",
    "zh-CN": "原罪信念特质",
    "zh-TW": "原罪信念特質"
  },
  "namePlain": {
    "ar": "سمة الإيمان بتأصل الشر",
    "de": "Eigenschaft: Glaube an die Ursünde",
    "en": "Belief in Original Sin Trait",
    "es": "Rasgo Fe en pecado original",
    "fr": "Croyance: Péché originel",
    "fr-CA": "Croyance: Péché originel",
    "it": "Tratto: Fede nel peccato originale",
    "ja": "特性「原罪主義者」",
    "ko": "원죄 신앙 특성",
    "nl": "Geloof in erfzonde-eigenschap",
    "pt-BR": "Aspecto Crença no Pecado Original",
    "ru": "Вера в первородный грех",
    "tr": "Asli Günah İnancı Özelliği",
    "zh-CN": "原罪信念特质",
    "zh-TW": "原罪信念特質"
  },
  "ritual": null,
  "thumb": "icons/doctrines/64/LawOrder_TraitDisciplinarian.png"
}
