{
  "alternative": "LawOrder_AssignFaithEnforcerRitual",
  "category": "LawAndOrder",
  "choice": "second",
  "description": {
    "ar": "يمكنك أداء <color=#FFD201>طقس</color> في مجمعك لتعيين عضو تابع <color=#FFD201>فارض ضرائب</color> مع تكليفه بجمع <sprite name=\"icon_blackgold\"> من أعضاء الطائفة الآخرين.",
    "de": "Führe im Tempel ein <color=#FFD201>Ritual</color> durch, bei dem du einen Anhänger zum <color=#FFD201>Steuereintreiber</color> ernennst, der <sprite name=\"icon_blackgold“> von den anderen Kultmitgliedern einsammelt.",
    "en": "Perform a <color=#FFD201>Ritual</color> at your temple in which you appoint a Follower as your <color=#FFD201>Tax Enforcer,</color> tasked with collecting <sprite name=\"icon_blackgold\"> from other Cult members.",
    "es": "Realiza un <color=#FFD201>ritual</color> en el templo para asignar a un adepto el cargo de <color=#FFD201>recaudador de impuestos</color>. Recaudará <sprite name=\"icon_blackgold\"> de otros miembros de la secta.",
    "fr": "Débloque le <color=#FFD201>rituel</color> permettant de nommer un <color=#FFD201>Garde des dons</color>. Il récoltera des <sprite name=\"icon_blackgold\"> auprès des autres membres du culte.",
    "fr-CA": "<color=#FFD201>Rituel</color> à effectuer dans le Temple et permettant de nommer un <color=#FFD201>Percepteur des dons</color>. Il récoltera des <sprite name=\"icon_blackgold\"> auprès des autres membres de la secte.",
    "it": "Celebra un <color=#FFD201>rito</color> al Tempio per nominare un membro <color=#FFD201>Braccio tributario</color>, col compito di riscuotere <sprite name=\"icon_blackgold\"> dagli altri membri del Culto.",
    "ja": "信者を<color=#FFD201>寄付徴収係</color>に任命する<color=#FFD201>儀式</color>を教会堂で行う。担当となった者はほかの信者から <sprite name=\"icon_blackgold\"> を集める",
    "ko": "<color=#FFD201>의식</color>을 수행해 추종자 중 한 명을 지명해 당신의 <color=#FFD201>수금 집행인</color>으로 삼으며, 다른 교단원으로부터 <sprite name=\"icon_blackgold\">을 모읍니다.",
    "nl": "Voer een <color=#FFD201>ritueel</color> uit in je tempel waarin je een volgeling benoemt tot je <color=#FFD201>afdrachthulpje,</color> belast met het innen van <sprite name=\"icon_blackgold\"> bij andere sekteleden.",
    "pt-BR": "Realize um <color=#FFD201>Ritual</color> em seu templo para indicar um Seguidor como seu <color=#FFD201>Coletor de Impostos</color>, que coletará <sprite name=\"icon_blackgold”> dos membros do Culto.",
    "ru": "Вы можете провести в храме <color=#FFD201>ритуал</color>, чтобы назначить последователя <color=#FFD201>сборщиком налогов</color> и поручить ему собирать <sprite name=\"icon_blackgold\"> с других последователей.",
    "tr": "Tapınak'ta bir <color=#FFD201>Ayin</color> düzenleyerek bir Takipçi'yi <color=#FFD201>Vergi Görevlisi</color> olarak atarsın. Vergi Görevlisi diğer Tarikat üyelerinden <sprite name=\"icon_blackgold\"> toplar.",
    "zh-CN": "在圣殿举行<color=#FFD201>仪式</color>，任命一名教徒成为<color=#FFD201>收税员</color>，负责向其他教徒收取<sprite name=\"icon_blackgold\">。",
    "zh-TW": "在你的聖殿舉行<color=#FFD201>儀式</color>，任命一位教徒擔任你的<color=#FFD201>收稅員</color>，負責向其他教會成員收取 <sprite name=\"icon_blackgold\">。"
  },
  "descriptionPlain": {
    "ar": "يمكنك أداء طقس في مجمعك لتعيين عضو تابع فارض ضرائب مع تكليفه بجمع من أعضاء الطائفة الآخرين.",
    "de": "Führe im Tempel ein Ritual durch, bei dem du einen Anhänger zum Steuereintreiber ernennst, der von den anderen Kultmitgliedern einsammelt.",
    "en": "Perform a Ritual at your temple in which you appoint a Follower as your Tax Enforcer, tasked with collecting from other Cult members.",
    "es": "Realiza un ritual en el templo para asignar a un adepto el cargo de recaudador de impuestos. Recaudará de otros miembros de la secta.",
    "fr": "Débloque le rituel permettant de nommer un Garde des dons. Il récoltera des auprès des autres membres du culte.",
    "fr-CA": "Rituel à effectuer dans le Temple et permettant de nommer un Percepteur des dons. Il récoltera des auprès des autres membres de la secte.",
    "it": "Celebra un rito al Tempio per nominare un membro Braccio tributario, col compito di riscuotere dagli altri membri del Culto.",
    "ja": "信者を寄付徴収係に任命する儀式を教会堂で行う。担当となった者はほかの信者から を集める",
    "ko": "의식을 수행해 추종자 중 한 명을 지명해 당신의 수금 집행인으로 삼으며, 다른 교단원으로부터 을 모읍니다.",
    "nl": "Voer een ritueel uit in je tempel waarin je een volgeling benoemt tot je afdrachthulpje, belast met het innen van bij andere sekteleden.",
    "pt-BR": "Realize um Ritual em seu templo para indicar um Seguidor como seu Coletor de Impostos, que coletará dos membros do Culto.",
    "ru": "Вы можете провести в храме ритуал, чтобы назначить последователя сборщиком налогов и поручить ему собирать с других последователей.",
    "tr": "Tapınak'ta bir Ayin düzenleyerek bir Takipçi'yi Vergi Görevlisi olarak atarsın. Vergi Görevlisi diğer Tarikat üyelerinden toplar.",
    "zh-CN": "在圣殿举行仪式，任命一名教徒成为收税员，负责向其他教徒收取。",
    "zh-TW": "在你的聖殿舉行儀式，任命一位教徒擔任你的收稅員，負責向其他教會成員收取 。"
  },
  "icon": "icons/doctrines/LawOrder_AssignTaxCollectorRitual.png",
  "id": "LawOrder_AssignTaxCollectorRitual",
  "kind": "Ritual",
  "level": 4,
  "name": {
    "ar": "فارض الضرائب",
    "de": "Steuereintreiber",
    "en": "Tax Enforcer",
    "es": "Recaudador de impuestos",
    "fr": "Garde des dons",
    "fr-CA": "Percepteur des dons",
    "it": "Braccio tributario",
    "ja": "寄付徴収係",
    "ko": "수금 집행인",
    "nl": "Afdrachthulpje",
    "pt-BR": "Coletor de Impostos",
    "ru": "Сбор налогов",
    "tr": "Vergi Görevlisi",
    "zh-CN": "收税员",
    "zh-TW": "收稅員"
  },
  "namePlain": {
    "ar": "فارض الضرائب",
    "de": "Steuereintreiber",
    "en": "Tax Enforcer",
    "es": "Recaudador de impuestos",
    "fr": "Garde des dons",
    "fr-CA": "Percepteur des dons",
    "it": "Braccio tributario",
    "ja": "寄付徴収係",
    "ko": "수금 집행인",
    "nl": "Afdrachthulpje",
    "pt-BR": "Coletor de Impostos",
    "ru": "Сбор налогов",
    "tr": "Vergi Görevlisi",
    "zh-CN": "收税员",
    "zh-TW": "收稅員"
  },
  "ritual": "Ritual_AssignTaxCollector",
  "thumb": "icons/doctrines/64/LawOrder_AssignTaxCollectorRitual.png"
}
