{
  "alternative": "Pleasure_Nudist",
  "category": "Pleasure",
  "choice": "second",
  "description": {
    "ar": "يمكنك السماح لأتباعك بالانغماس في الفوضى والعنف. عليك تحديد قائد الغضب لتسلم <color=#FFD201>خطيئة</color> <sprite name=\"icon_SinDoctrine\">",
    "de": "Deine Anhänger dürfen sich in Chaos und Gewalt austoben. Wähle den Zorn-Anführer aus, um <color=#FFD201>Sünde</color> <sprite name=\"icon_SinDoctrine\"> zu erhalten.",
    "en": "Let your Followers indulge in havoc and violence. Select the Wrath Leader to receive <color=#FFD201>Sin</color> <sprite name=\"icon_SinDoctrine\">",
    "es": "Permite que tus adeptos siembren el caos y promuevan la violencia. Elige al líder de la ira para recibir <color=#FFD201>Pecado</color> <sprite name=\"icon_SinDoctrine\">",
    "fr": "Laissez vos adeptes s'adonner au chaos et à la violence. Élisez le chef de la colère et obtenez du <color=#FFD201>péché</color> <sprite name=\"icon_SinDoctrine\">.",
    "fr-CA": "Laissez vos adeptes s'adonner au chaos et à la violence. Élisez le leader de la fureur et obtenez du <color=#FFD201>péché</color> <sprite name=\"icon_SinDoctrine\">.",
    "it": "Lascia che i membri del Culto si abbandonino al caos e alla violenza. Eleggi la Guida iraconda per generare <color=#FFD201>Peccato</color> <sprite name=\"icon_SinDoctrine\">.",
    "ja": "信者たちに混乱と暴力の道を解放する。<color=#FFD201>罪</color> <sprite name=\"icon_SinDoctrine\"> を受け取る憤怒の先導者を選ぶ",
    "ko": "추종자들이 파괴와 폭력에 몰두하게 합니다. 가장 분노를 잘 표출한 자에게 <color=#FFD201>죄</color> <sprite name=\"icon_SinDoctrine\">를 받게 합니다.",
    "nl": "Laat je volgelingen zich te buiten gaan aan geweld en verwoesting. Kies de wraakleider om <color=#FFD201>zonde</color> <sprite name=\"icon_SinDoctrine\"> te ontvangen.",
    "pt-BR": "Deixe seus Seguidores se deleitarem com caos e violência. Eleja o Líder da Fúria para receber <color=#FFD201>Pecado</color> <sprite name=\"icon_SinDoctrine\">",
    "ru": "Последователи дают волю ярости. Вы можете объявить кого-либо из них сорвиголовой дня, чтобы породить <color=#FFD201>грех</color> <sprite name=\"icon_SinDoctrine\">.",
    "tr": "Takipçilerin vahşet dolu şiddetli bir kavgaya tutuşur. <color=#FFD201>Günah</color> <sprite name=\"icon_SinDoctrine\"> kazanması için Gazap Önderi'ni seç.",
    "zh-CN": "让教徒沉浸在混乱及暴力之中。选出愤怒领袖获得<color=#FFD201>罪孽</color> <sprite name=\"icon_SinDoctrine\">",
    "zh-TW": "讓教徒沉浸在混亂及暴力之中。選出憤怒領袖獲得<color=#FFD201>罪孽</color> <sprite name=\"icon_SinDoctrine\">"
  },
  "descriptionPlain": {
    "ar": "يمكنك السماح لأتباعك بالانغماس في الفوضى والعنف. عليك تحديد قائد الغضب لتسلم خطيئة",
    "de": "Deine Anhänger dürfen sich in Chaos und Gewalt austoben. Wähle den Zorn-Anführer aus, um Sünde zu erhalten.",
    "en": "Let your Followers indulge in havoc and violence. Select the Wrath Leader to receive Sin",
    "es": "Permite que tus adeptos siembren el caos y promuevan la violencia. Elige al líder de la ira para recibir Pecado",
    "fr": "Laissez vos adeptes s'adonner au chaos et à la violence. Élisez le chef de la colère et obtenez du péché.",
    "fr-CA": "Laissez vos adeptes s'adonner au chaos et à la violence. Élisez le leader de la fureur et obtenez du péché.",
    "it": "Lascia che i membri del Culto si abbandonino al caos e alla violenza. Eleggi la Guida iraconda per generare Peccato.",
    "ja": "信者たちに混乱と暴力の道を解放する。罪 を受け取る憤怒の先導者を選ぶ",
    "ko": "추종자들이 파괴와 폭력에 몰두하게 합니다. 가장 분노를 잘 표출한 자에게 죄 를 받게 합니다.",
    "nl": "Laat je volgelingen zich te buiten gaan aan geweld en verwoesting. Kies de wraakleider om zonde te ontvangen.",
    "pt-BR": "Deixe seus Seguidores se deleitarem com caos e violência. Eleja o Líder da Fúria para receber Pecado",
    "ru": "Последователи дают волю ярости. Вы можете объявить кого-либо из них сорвиголовой дня, чтобы породить грех.",
    "tr": "Takipçilerin vahşet dolu şiddetli bir kavgaya tutuşur. Günah kazanması için Gazap Önderi'ni seç.",
    "zh-CN": "让教徒沉浸在混乱及暴力之中。选出愤怒领袖获得罪孽",
    "zh-TW": "讓教徒沉浸在混亂及暴力之中。選出憤怒領袖獲得罪孽"
  },
  "icon": "icons/doctrines/Pleasure_Purge.png",
  "id": "Pleasure_Purge",
  "kind": null,
  "level": 1,
  "name": {
    "ar": "مراسم الغضب",
    "de": "Ritual des Zorns",
    "en": "Rite of Wrath",
    "es": "Rito de la ira",
    "fr": "Rituel de la colère",
    "fr-CA": "Rituel de la colère",
    "it": "Rito dell'Ira",
    "ja": "憤怒の儀式",
    "ko": "분노의 의식",
    "nl": "Wraakritueel",
    "pt-BR": "Ritual da Fúria",
    "ru": "Гнев толпы",
    "tr": "Gazap Ayini",
    "zh-CN": "愤怒仪式",
    "zh-TW": "憤怒儀式"
  },
  "namePlain": {
    "ar": "مراسم الغضب",
    "de": "Ritual des Zorns",
    "en": "Rite of Wrath",
    "es": "Rito de la ira",
    "fr": "Rituel de la colère",
    "fr-CA": "Rituel de la colère",
    "it": "Rito dell'Ira",
    "ja": "憤怒の儀式",
    "ko": "분노의 의식",
    "nl": "Wraakritueel",
    "pt-BR": "Ritual da Fúria",
    "ru": "Гнев толпы",
    "tr": "Gazap Ayini",
    "zh-CN": "愤怒仪式",
    "zh-TW": "憤怒儀式"
  },
  "ritual": "Ritual_Purge",
  "thumb": "icons/doctrines/64/Pleasure_Purge.png"
}
