{
  "alternative": "Pleasure_AtoneSin",
  "category": "Pleasure",
  "choice": "second",
  "description": {
    "ar": "سيلتهم الأتباع تابعًا مختارًا. <br>ينتج <color=#FFD201>خطيئة</color> كاملة <sprite name=\"icon_SinDoctrine\"> لكن يُفقد -40 من العقيدة. <br><br>(هذا لا يتأثر <color=#FFD201>بسمة آكل اللحوم.</color>)",
    "de": "Anhänger verspeisen einen ausgewählten Anhänger. <br>Erzeugt volle <color=#FFD201>Sünde</color> <sprite name=\"icon_SinDoctrine\">, aber -40 Glauben geht verloren. <br><br>(Bleibt von der <color=#FFD201>Eigenschaft: Kannibale</color> unbeeinflusst.)",
    "en": "Followers feast upon a chosen Follower. <br>Generates full <color=#FFD201>Sin</color> <sprite name=\"icon_SinDoctrine\"> but lose -40 Faith. <br><br>(This is unaffected by the <color=#FFD201>Cannibal trait.</color>)",
    "es": "Los adeptos devoran al adepto elegido. <br>Genera la cantidad máxima de <color=#FFD201>Pecado</color> <sprite name=\"icon_SinDoctrine\">, pero pierdes 40 de fe. <br><br>(No surte efecto con el <color=#FFD201>rasgo Caníbal</color>).",
    "fr": "Les adeptes se nourrissent d'un adepte choisi. <br>Génère du <color=#FFD201>péché</color> <sprite name=\"icon_SinDoctrine\"> au maximum, mais vous perdrez 40 de foi. <br><br>(Perte de foi non annulée par la <color=#FFD201>croyance Cannibalisme.</color>)",
    "fr-CA": "Les adeptes se nourrissent d'un adepte choisi. <br>Génère du <color=#FFD201>péché</color> <sprite name=\"icon_SinDoctrine\"> au maximum, mais vous perdrez 40 de foi. <br><br>(Perte de foi non annulée par la <color=#FFD201>croyance Cannibalisme.</color>)",
    "it": "I membri del Culto banchettano con un membro prescelto.<br>Il <color=#FFD201>Peccato</color> <sprite name=\"icon_SinDoctrine\"> raggiunge il massimo. -40 Fede.<br><br>(Non è influenzato dal tratto <color=#FFD201>Cannibalismo</color>).",
    "ja": "選ばれた信者1人を信者たちが食べる<br>最大値の<color=#FFD201>罪</color> <sprite name=\"icon_SinDoctrine\"> が生成されるが、信仰を40失う<br><br>（<color=#FFD201>特性「カニバリスト」</color>の影響を受けない）",
    "ko": "선택한 추종자를 추종자들이 잡아먹습니다. <br><color=#FFD201>죄</color> <sprite name=\"icon_SinDoctrine\">를 많이 생성하지만 40 신앙을 잃습니다.<br><br>(이 효과는 <color=#FFD201>식인 특성</color>의 효과를 받지 않습니다.)",
    "nl": "Volgelingen doen zich tegoed aan een gekozen volgeling. <br>Genereert volledige <color=#FFD201>zonde</color> <sprite name=\"icon_SinDoctrine\"> maar je verliest 40 geloof. <br><br>(Dit wordt niet beïnvloed door de <color=#FFD201>eigenschap Kannibaal</color>.)",
    "pt-BR": "Seguidores devoram um Seguidor escolhido. <br>Gera <color=#FFD201>Pecado</color> <sprite name=\"icon_SinDoctrine\"> até o máximo, mas perde -40 de Fé. <br><br>(Não é afetado pelo <color=#FFD201>Aspecto Canibal.</color>)",
    "ru": "Последователи съедают выбранного последователя.<br>Шкала <color=#FFD201>греховности</color> <sprite name=\"icon_SinDoctrine\"> заполняется, но вы теряете 40 ед. веры.<br>Особенность <color=#FFD201>«Каннибализм»</color> не требуется.",
    "tr": "Takipçiler seçilen bir Takipçi'yi yer. <br><color=#FFD201>Günah</color> <sprite name=\"icon_SinDoctrine\"> tamamen dolar fakat İnanç 40 azalır. <br><br>(<color=#FFD201>Yamyam</color> özelliğinden etkilenmez.)",
    "zh-CN": "徒众一起吃下一位获选的教徒。<br>产生完整<color=#FFD201>罪孽</color> <sprite name=\"icon_SinDoctrine\"> 但信仰值 -40。<br><br>（不受<color=#FFD201>同类相食特质</color>影响。）",
    "zh-TW": "徒眾一起吃下一位獲選的教徒。<br>產生完整<color=#FFD201>罪孽</color> <sprite name=\"icon_SinDoctrine\"> 但信仰值 -40。<br><br>（不受<color=#FFD201>同類相食特質</color>影響。）"
  },
  "descriptionPlain": {
    "ar": "سيلتهم الأتباع تابعًا مختارًا.\nينتج خطيئة كاملة لكن يُفقد -40 من العقيدة.\n\n(هذا لا يتأثر بسمة آكل اللحوم.)",
    "de": "Anhänger verspeisen einen ausgewählten Anhänger.\nErzeugt volle Sünde, aber -40 Glauben geht verloren.\n\n(Bleibt von der Eigenschaft: Kannibale unbeeinflusst.)",
    "en": "Followers feast upon a chosen Follower.\nGenerates full Sin but lose -40 Faith.\n\n(This is unaffected by the Cannibal trait.)",
    "es": "Los adeptos devoran al adepto elegido.\nGenera la cantidad máxima de Pecado, pero pierdes 40 de fe.\n\n(No surte efecto con el rasgo Caníbal).",
    "fr": "Les adeptes se nourrissent d'un adepte choisi.\nGénère du péché au maximum, mais vous perdrez 40 de foi.\n\n(Perte de foi non annulée par la croyance Cannibalisme.)",
    "fr-CA": "Les adeptes se nourrissent d'un adepte choisi.\nGénère du péché au maximum, mais vous perdrez 40 de foi.\n\n(Perte de foi non annulée par la croyance Cannibalisme.)",
    "it": "I membri del Culto banchettano con un membro prescelto.\nIl Peccato raggiunge il massimo. -40 Fede.\n\n(Non è influenzato dal tratto Cannibalismo).",
    "ja": "選ばれた信者1人を信者たちが食べる\n最大値の罪 が生成されるが、信仰を40失う\n\n（特性「カニバリスト」の影響を受けない）",
    "ko": "선택한 추종자를 추종자들이 잡아먹습니다.\n죄 를 많이 생성하지만 40 신앙을 잃습니다.\n\n(이 효과는 식인 특성의 효과를 받지 않습니다.)",
    "nl": "Volgelingen doen zich tegoed aan een gekozen volgeling.\nGenereert volledige zonde maar je verliest 40 geloof.\n\n(Dit wordt niet beïnvloed door de eigenschap Kannibaal.)",
    "pt-BR": "Seguidores devoram um Seguidor escolhido.\nGera Pecado até o máximo, mas perde -40 de Fé.\n\n(Não é afetado pelo Aspecto Canibal.)",
    "ru": "Последователи съедают выбранного последователя.\nШкала греховности заполняется, но вы теряете 40 ед. веры.\nОсобенность «Каннибализм» не требуется.",
    "tr": "Takipçiler seçilen bir Takipçi'yi yer.\nGünah tamamen dolar fakat İnanç 40 azalır.\n\n(Yamyam özelliğinden etkilenmez.)",
    "zh-CN": "徒众一起吃下一位获选的教徒。\n产生完整罪孽 但信仰值 -40。\n\n（不受同类相食特质影响。）",
    "zh-TW": "徒眾一起吃下一位獲選的教徒。\n產生完整罪孽 但信仰值 -40。\n\n（不受同類相食特質影響。）"
  },
  "icon": "icons/doctrines/Pleasure_Cannibal.png",
  "id": "Pleasure_Cannibal",
  "kind": null,
  "level": 2,
  "name": {
    "ar": "شراهة آكلي اللحوم",
    "de": "Völlerei der Kannibalen",
    "en": "Gluttony of Cannibals",
    "es": "Gula del caníbal",
    "fr": "Gourmandise cannibale",
    "fr-CA": "Gourmandise cannibale",
    "it": "Rito dell'ingordigia cannibalesca",
    "ja": "暴食なる共食いの儀式",
    "ko": "과다 식인의 의식",
    "nl": "Gulzigheid van kannibalen",
    "pt-BR": "Gula dos Canibais",
    "ru": "Чревоугодие каннибалов",
    "tr": "Yamyamların Oburluğu",
    "zh-CN": "暴食同类",
    "zh-TW": "暴食同類"
  },
  "namePlain": {
    "ar": "شراهة آكلي اللحوم",
    "de": "Völlerei der Kannibalen",
    "en": "Gluttony of Cannibals",
    "es": "Gula del caníbal",
    "fr": "Gourmandise cannibale",
    "fr-CA": "Gourmandise cannibale",
    "it": "Rito dell'ingordigia cannibalesca",
    "ja": "暴食なる共食いの儀式",
    "ko": "과다 식인의 의식",
    "nl": "Gulzigheid van kannibalen",
    "pt-BR": "Gula dos Canibais",
    "ru": "Чревоугодие каннибалов",
    "tr": "Yamyamların Oburluğu",
    "zh-CN": "暴食同类",
    "zh-TW": "暴食同類"
  },
  "ritual": "Ritual_Cannibal",
  "thumb": "icons/doctrines/64/Pleasure_Cannibal.png"
}
