{
  "alternative": "Sustenance_TraitGrassEater",
  "category": "Food",
  "choice": "first",
  "description": {
    "ar": "سيكتسب جميع أعضاء الطائفة <color=#FFD201>سمة آكل اللحوم.</color> <br> <sprite name=\"icon_FaithUp\"> يمكن اكتساب +5 من العقيدة عند تناول وجبة مصنوعة من لحم أتباع.",
    "de": "Alle Kultmitglieder erhalten die <color=#FFD201>Eigenschaft: Kannibale</color>. <br> <sprite name=\"icon_FaithUp\"> +5 Glauben, wenn sie eine Mahlzeit aus Anhängerfleisch essen.",
    "en": "All Cult members will gain the <color=#FFD201>Cannibal Trait.</color> <br> <sprite name=\"icon_FaithUp\"> +5 Faith when eating meal made from Follower meat.",
    "es": "Todos los miembros de la secta recibirán el <color=#FFD201>rasgo Caníbal</color>. <br> <sprite name=\"icon_FaithUp\"> +5 de fe cuando coman un plato hecho con la carne de otro adepto.",
    "fr": "Tous les membres du culte gagnent la croyance : <color=#FFD201>Cannibalisme</color>. <br> <sprite name=\"icon_FaithUp\"> +5 de foi en mangeant un plat à base de chair d'adepte.",
    "fr-CA": "Tous les membres de la secte gagnent la croyance : <color=#FFD201>Cannibalisme</color>. <br> <sprite name=\"icon_FaithUp\"> +5 de foi en mangeant un plat à base de chair d'adepte.",
    "it": "I membri del Culto ricevono il tratto <color=#FFD201>Cannibalismo</color>.<br><sprite name=\"icon_FaithUp\"> +5 Fede quando viene consumato un pasto a base di carni di seguace.",
    "ja": "すべての信者が<color=#FFD201>特性「カニバリスト」</color>を得る。 <br> <sprite name=\"icon_FaithUp\"> 信者肉を使った料理を食べるたび、信仰を5得る",
    "ko": "모든 교단원들이 <color=#FFD201>식인 특성</color>을 얻습니다. <br> <sprite name=\"icon_FaithUp\"> 다른 추종자로 구성된 음식을 먹을 때마다 +5 신앙을 얻습니다.",
    "nl": "Alle volgelingen krijgen de eigenschap <color=#FFD201>Kannibaal.</color> <br> <sprite name=\"icon_FaithUp\"> +5 geloof als ze een maaltijd eten die van volgelingenvlees is gemaakt.",
    "pt-BR": "Todos os membros do Culto ganharão o <color=#FFD201>Aspecto Canibal.</color> <br> <sprite name=\"icon_FaithUp\"> +5 de Fé ao comer refeições feitas com carne de Seguidores.",
    "ru": "Все последователи получают особенность <color=#FFD201>«Каннибализм»</color>.<br><sprite name=\"icon_FaithUp\"> Вера увеличивается на 5 ед. при поедании пищи из мяса последователя.",
    "tr": "Tüm Tarikat üyeleri <color=#FFD201>Yamyam Özelliği</color> kazanır. <br> <sprite name=\"icon_FaithUp\"> Takipçiler, Takipçi etinden yapılmış bir yemek yediğinde İnanç +5 artar.",
    "zh-CN": "所有教会成员将获得<color=#FFD201>同类相食特质。</color> <br> <sprite name=\"icon_FaithUp\"> 食用教徒之肉制成的餐点时信仰值 +5。",
    "zh-TW": "所有教會成員將獲得<color=#FFD201>同類相食特質。</color> <br> <sprite name=\"icon_FaithUp\"> 食用教徒之肉製成的餐點時信仰值 +5。"
  },
  "descriptionPlain": {
    "ar": "سيكتسب جميع أعضاء الطائفة سمة آكل اللحوم.\nيمكن اكتساب +5 من العقيدة عند تناول وجبة مصنوعة من لحم أتباع.",
    "de": "Alle Kultmitglieder erhalten die Eigenschaft: Kannibale.\n+5 Glauben, wenn sie eine Mahlzeit aus Anhängerfleisch essen.",
    "en": "All Cult members will gain the Cannibal Trait.\n+5 Faith when eating meal made from Follower meat.",
    "es": "Todos los miembros de la secta recibirán el rasgo Caníbal.\n+5 de fe cuando coman un plato hecho con la carne de otro adepto.",
    "fr": "Tous les membres du culte gagnent la croyance: Cannibalisme.\n+5 de foi en mangeant un plat à base de chair d'adepte.",
    "fr-CA": "Tous les membres de la secte gagnent la croyance: Cannibalisme.\n+5 de foi en mangeant un plat à base de chair d'adepte.",
    "it": "I membri del Culto ricevono il tratto Cannibalismo.\n+5 Fede quando viene consumato un pasto a base di carni di seguace.",
    "ja": "すべての信者が特性「カニバリスト」を得る。\n信者肉を使った料理を食べるたび、信仰を5得る",
    "ko": "모든 교단원들이 식인 특성을 얻습니다.\n다른 추종자로 구성된 음식을 먹을 때마다 +5 신앙을 얻습니다.",
    "nl": "Alle volgelingen krijgen de eigenschap Kannibaal.\n+5 geloof als ze een maaltijd eten die van volgelingenvlees is gemaakt.",
    "pt-BR": "Todos os membros do Culto ganharão o Aspecto Canibal.\n+5 de Fé ao comer refeições feitas com carne de Seguidores.",
    "ru": "Все последователи получают особенность «Каннибализм».\nВера увеличивается на 5 ед. при поедании пищи из мяса последователя.",
    "tr": "Tüm Tarikat üyeleri Yamyam Özelliği kazanır.\nTakipçiler, Takipçi etinden yapılmış bir yemek yediğinde İnanç +5 artar.",
    "zh-CN": "所有教会成员将获得同类相食特质。\n食用教徒之肉制成的餐点时信仰值 +5。",
    "zh-TW": "所有教會成員將獲得同類相食特質。\n食用教徒之肉製成的餐點時信仰值 +5。"
  },
  "icon": "icons/doctrines/Sustenance_TraitCannibal.png",
  "id": "Sustenance_TraitCannibal",
  "kind": "Trait",
  "level": 2,
  "name": {
    "ar": "سمة آكل اللحوم",
    "de": "Eigenschaft: Kannibale",
    "en": "Cannibal Trait",
    "es": "Rasgo Caníbal",
    "fr": "Croyance : Cannibalisme",
    "fr-CA": "Croyance : Cannibalisme",
    "it": "Tratto: Cannibalismo",
    "ja": "特性「カニバリスト」",
    "ko": "식인 특성",
    "nl": "Kannibaal-eigenschap",
    "pt-BR": "Aspecto Canibal",
    "ru": "Каннибализм",
    "tr": "Yamyam Özelliği",
    "zh-CN": "同类相食特质",
    "zh-TW": "同類相食特質"
  },
  "namePlain": {
    "ar": "سمة آكل اللحوم",
    "de": "Eigenschaft: Kannibale",
    "en": "Cannibal Trait",
    "es": "Rasgo Caníbal",
    "fr": "Croyance: Cannibalisme",
    "fr-CA": "Croyance: Cannibalisme",
    "it": "Tratto: Cannibalismo",
    "ja": "特性「カニバリスト」",
    "ko": "식인 특성",
    "nl": "Kannibaal-eigenschap",
    "pt-BR": "Aspecto Canibal",
    "ru": "Каннибализм",
    "tr": "Yamyam Özelliği",
    "zh-CN": "同类相食特质",
    "zh-TW": "同類相食特質"
  },
  "ritual": null,
  "thumb": "icons/doctrines/64/Sustenance_TraitCannibal.png"
}
